{
    "$schema": "https://json-schema.org/draft/2020-12/schema",
    "title": "Polaris implementation record",
    "type": "object",
    "required": [
        "task_id",
        "work_item_revision",
        "artifact_attempt",
        "implementer_session_id",
        "implementation_handoff_path",
        "implementation_handoff_sha256",
        "subject_base_commit",
        "subject_head_commit",
        "subject_diff_hash",
        "step_results",
        "deviations",
        "checks"
    ],
    "additionalProperties": false,
    "properties": {
        "task_id": {
            "type": "string",
            "pattern": "^TASK-[0-9]{4}$"
        },
        "work_item_revision": {
            "type": "integer",
            "minimum": 1
        },
        "artifact_attempt": {
            "type": "integer",
            "minimum": 1
        },
        "implementer_session_id": {
            "type": "string",
            "pattern": "^[A-Za-z0-9][A-Za-z0-9._:-]{2,127}$"
        },
        "implementation_handoff_path": {
            "type": "string"
        },
        "implementation_handoff_sha256": {
            "type": "string",
            "pattern": "^[0-9a-f]{64}$"
        },
        "subject_base_commit": {
            "type": "string",
            "pattern": "^[0-9a-f]{40}$"
        },
        "subject_head_commit": {
            "type": "string",
            "pattern": "^[0-9a-f]{40}$"
        },
        "subject_diff_hash": {
            "type": "string",
            "pattern": "^[0-9a-f]{64}$"
        },
        "step_results": {
            "type": "array",
            "minItems": 1,
            "items": {
                "type": "object",
                "required": [
                    "id",
                    "status",
                    "result"
                ],
                "additionalProperties": false,
                "properties": {
                    "id": {
                        "type": "string",
                        "pattern": "^STEP-[0-9]{3}$"
                    },
                    "status": {
                        "type": "string",
                        "enum": [
                            "COMPLETED",
                            "SKIPPED"
                        ]
                    },
                    "result": {
                        "type": "string",
                        "minLength": 1
                    }
                }
            }
        },
        "deviations": {
            "type": "array",
            "items": {
                "type": "string"
            }
        },
        "checks": {
            "type": "array",
            "items": {
                "type": "object"
            }
        },
        "code_intelligence": {
            "type": ["object", "null"],
            "required": ["path", "sha256"],
            "additionalProperties": false,
            "properties": {
                "path": {"type": "string", "minLength": 1},
                "sha256": {"type": "string", "pattern": "^[0-9a-f]{64}$"}
            }
        }
    }
}
